[
    {
        "title": "Search and Filter Functionality for Online Shopping Site",
        "description": "A case study of implementing search and filter functionality for an online shopping site.",
        "user_story": "As a user, I want to be able to search for products by category, brand, and price range, and see the results in a sortable and filterable list.",
        "sources_of_complexity": [
            "Complex database queries and indexing required for performant and accurate search functionality",
            "Complex algorithms and data structures required for efficient sorting and filtering",
            "Design and implementation of user interface for search results from scratch"
        ],
        "refactored_user_stories": [
            "As a user, I want to be able to search for products by category, brand, and price range.",
            "As a user, I want to see search results displayed in a list.",
            "As a user, I want to be able to sort search results by price, name, and popularity.",
            "As a user, I want to be able to filter search results by brand, category, and availability."
        ],
        "implementation_issues": [
            "Search functionality was too slow due to the size of the product database.",
            "Designing and implementing the user interface for search results took longer than anticipated."
        ],
        "agile_principles": [
            "Maximizing the amount of work not done by breaking down complex user stories into smaller, more manageable pieces that can be implemented and tested independently."
        ]
    },
    {
        "title": "Refactoring User Story for Blogging Platform",
        "description": "A case study of how refactoring a user story helped to address complexity and uncertainty in the development of a blogging platform.",
        "user_story": "As a user, I want to be able to create blog posts, edit them, and publish them on the platform.",
        "sources_of_complexity": [
            "User interface for creating and editing blog posts needed to be designed and implemented.",
            "Permissions and access control for publishing blog posts needed to be implemented.",
            "Optimization for handling a large volume of blog posts and ensuring that the platform is performant."
        ],
        "refactored_user_stories": [
            "As a user, I want to be able to create blog posts.",
            "As a user, I want to be able to edit my blog posts.",
            "As a user, I want to be able to publish my blog posts.",
            "As an administrator, I want to be able to manage permissions for publishing blog posts.",
            "As a developer, I want to optimize the platform to handle a large volume of blog posts."
        ],
        "implementation_issues": [
            "Designing and implementing the user interface for creating and editing blog posts took longer than anticipated.",
            "Implementing permissions and access control for publishing blog posts required significant testing to ensure security and privacy.",
            "Optimizing the platform to handle a large volume of blog posts required careful analysis and profiling of the platform's performance."
        ],
        "agile_principles": [
            "Maximizing the amount of work not done by breaking down complex user stories into smaller, more manageable pieces that can be implemented and tested independently.",
            "Iteratively testing and refining the implementation of features based on user feedback and usage patterns."
        ]
    },
    {
        "title": "Refactoring User Story for E-commerce Platform",
        "description": "A case study of how refactoring a user story helped to address complexity and uncertainty in the development of an e-commerce platform.",
        "user_story": "As a user, I want to be able to browse products, add them to my cart, and checkout with payment and shipping options.",
        "sources_of_complexity": [
            "User interface for browsing products and managing the cart needed to be designed and implemented.",
            "Integration with payment and shipping providers required careful attention to security and privacy concerns.",
            "Scalability and performance issues arose due to the large volume of products and user traffic on the platform."
        ],
        "refactored_user_stories": [
            "As a user, I want to be able to browse products.",
            "As a user, I want to be able to add products to my cart.",
            "As a user, I want to be able to view and manage my cart.",
            "As a user, I want to be able to checkout with payment and shipping options.",
            "As a developer, I want to optimize the platform for scalability and performance.",
            "As a developer, I want to ensure secure and reliable integration with payment and shipping providers."
        ],
        "implementation_issues": [
            "Designing and implementing the user interface for browsing products and managing the cart required significant user testing and feedback.",
            "Integrating with payment and shipping providers required close collaboration and communication with their development teams.",
            "Optimizing the platform for scalability and performance required careful analysis of usage patterns and load testing."
        ],
        "agile_principles": [
            "Maximizing the amount of work not done by breaking down complex user stories into smaller, more manageable pieces that can be implemented and tested independently.",
            "Iteratively testing and refining the implementation of features based on user feedback and usage patterns.",
            "Collaborating with external partners to ensure successful integration of their services with the platform."
        ]
    },
    {
        "title": "Refactoring User Story for Mobile Banking App",
        "description": "A case study of how refactoring a user story helped to address complexity and uncertainty in the development of a mobile banking app.",
        "user_story": "As a user, I want to be able to view my account balances, transaction history, and transfer funds between accounts.",
        "sources_of_complexity": [
            "Secure authentication and authorization functionality needed to be implemented to ensure user privacy and security.",
            "Integration with financial institutions and payment providers required careful attention to regulatory compliance and risk management.",
            "User interface for viewing and managing account information and transferring funds needed to be designed and implemented."
        ],
        "refactored_user_stories": [
            "As a user, I want to be able to view my account balances and transaction history.",
            "As a user, I want to be able to transfer funds between my accounts.",
            "As a developer, I want to implement secure authentication and authorization functionality.",
            "As a developer, I want to ensure compliance with financial regulations and risk management best practices.",
            "As a designer, I want to design a user-friendly interface for viewing and managing account information and transferring funds."
        ],
        "implementation_issues": [
            "Implementing secure authentication and authorization functionality required close collaboration with security experts and thorough testing and verification.",
            "Ensuring compliance with financial regulations and risk management best practices required extensive research and analysis.",
            "Designing a user-friendly interface for viewing and managing account information and transferring funds required significant user testing and feedback."
        ],
        "agile_principles": [
            "Maximizing the amount of work not done by breaking down complex user stories into smaller, more manageable pieces that can be implemented and tested independently.",
            "Collaborating with security experts and regulatory compliance specialists to ensure successful implementation of key features.",
            "Iteratively testing and refining the implementation of features based on user feedback and usage patterns."
        ]
    },
    {
        "title": "Refactoring User Story for Social Media Platform",
        "description": "A case study of how refactoring a user story helped to address complexity and uncertainty in the development of a social media platform.",
        "user_story": "As a user, I want to be able to post messages, images, and videos on the platform, and interact with other users through comments and likes.",
        "sources_of_complexity": [
            "Integration with media hosting and streaming services required careful attention to user privacy and bandwidth usage.",
            "User interface for posting messages, images, and videos and managing interactions needed to be designed and implemented.",
            "Optimization for handling a large volume of media and user traffic on the platform."
        ],
        "refactored_user_stories": [
            "As a user, I want to be able to post messages.",
            "As a user, I want to be able to post images.",
            "As a user, I want to be able to post videos.",
            "As a user, I want to be able to comment on other users' posts.",
            "As a user, I want to be able to like other users' posts.",
            "As a developer, I want to optimize the platform for scalability and performance.",
            "As a designer, I want to design a user-friendly interface for posting messages, images, and videos and managing interactions."
        ],
        "implementation_issues": [
            "Integrating with media hosting and streaming services required close collaboration with service providers and thorough testing and verification.",